{
  "target_table": "silver_nyc_airlines",
  "columns": [
    {
      "source_column": "carrier",
      "action": "keep",
      "target_name": "carrier",
      "logical_type": "string",
      "physical_type": "VARCHAR",
      "required": true,
      "null_handling": "not_applicable",
      "rationale": "null_rate is 0.0 and distinct_count is 16, matching the row_count of 16, with two-letter IATA-style codes such as AA, DL, UA, WN seen in the distinct_values; this is the natural identifier for each carrier."
    },
    {
      "source_column": "name",
      "action": "keep",
      "target_name": "name",
      "logical_type": "string",
      "physical_type": "VARCHAR",
      "required": true,
      "null_handling": "not_applicable",
      "rationale": "null_rate is 0.0 and distinct_count is 16 with full legal airline names such as 'Delta Air Lines Inc.' and 'Southwest Airlines Co.' present in distinct_values, so this is a fully populated descriptive attribute."
    },
    {
      "source_column": "_airbyte_raw_id",
      "action": "drop",
      "target_name": "",
      "logical_type": "string",
      "physical_type": "VARCHAR",
      "required": false,
      "null_handling": "not_applicable",
      "rationale": "Flagged is_airbyte_metadata true; it is a capture-tool UUID with distinct_count 16 and null_rate 0.0 but carries no business meaning and is excluded per policy."
    },
    {
      "source_column": "_airbyte_extracted_at",
      "action": "drop",
      "target_name": "",
      "logical_type": "date",
      "physical_type": "TIMESTAMP",
      "required": false,
      "null_handling": "not_applicable",
      "rationale": "Flagged is_airbyte_metadata true; a single constant extraction timestamp (2026-09-02T23:26:17) across all 16 rows, a capture-pipeline artifact rather than business data."
    },
    {
      "source_column": "_airbyte_meta",
      "action": "drop",
      "target_name": "",
      "logical_type": "string",
      "physical_type": "JSON",
      "required": false,
      "null_handling": "not_applicable",
      "rationale": "Flagged is_airbyte_metadata true; the only observed value is the empty JSON object '{}' across all rows, carrying no business information."
    }
  ],
  "dedupe_strategy": "none",
  "dedupe_keys": [],
  "grain_keys": [
    "carrier"
  ],
  "decisions": [
    {
      "key": "decisionGrain",
      "value": "carrier-code-as-grain",
      "rationale": "carrier has distinct_count 16 equal to row_count 16 with null_rate 0.0, making it the smallest column set that uniquely identifies a row; name is also fully populated but is descriptive, not identifying."
    },
    {
      "key": "decisionExactDuplicates",
      "value": "no-duplicates-found",
      "rationale": "duplicate_row_rate is 0.0 across row_count 16, so no exact duplicate rows exist in bronze and no dedupe step is required."
    },
    {
      "key": "decisionDroppedMetadata",
      "value": "excluded-as-capture-artifacts",
      "rationale": "_airbyte_raw_id, _airbyte_extracted_at, and _airbyte_meta are all flagged is_airbyte_metadata true and are capture-tool columns with no business meaning, so they are dropped from silver."
    }
  ],
  "purpose": "This table is a small reference dataset mapping two-letter airline carrier codes to their full legal airline names, intended to be joined against flight-level fact tables that record carrier codes.",
  "usage": "Consumers should join on the carrier column to enrich any fact table that records a two-letter carrier code with the full airline name; both carrier and name are required and fully populated so no null handling is needed by downstream consumers.",
  "limitations": "The profile shows no duplicate rows (duplicate_row_rate 0.0) and no nulls in either business column, so cleanup was limited to dropping the three Airbyte capture-metadata columns; the dataset is static at 16 rows as profiled and does not capture historical renames or mergers of carriers."
}
